<?xml version="1.0" encoding="UTF-8"  ?>
<!DOCTYPE excelUpload PUBLIC
         "-//TLab//DTD excep upload config XML V1.0//EN"
         "../excel-upload.dtd">
<workBook name="s_hpa350ukr_yp" desc="TEMPLATE_HPA350"  validateService="s_hpa350ukr_ypService.excelValidate" >
    <sheet seq="0" name="엑셀업로드" startRow="1" sqlId="s_hpa350ukr_ypServiceImpl.insertExcelUpload" validateFormName="s_hpa350ukr_yp">
        <field col="0" 		name="PAY_YYYYMM"		title="급여년월"		     type="string"   check="true">	</field>
		<field col="1"		name="PERSON_NUMB"		title="사번"			     type="string">  </field>
		<field col="2"		name="WAGES_DEDHIR"		title="고용보험"			 type="integer">  </field>
		<field col="3"		name="BUSI_SHARE_I"		title="고용보험 회사부담금"	     type="integer">  </field>
		<field col="4"		name="WAGES_DEDANU"		title="국민연금"			 type="integer">  </field>
		<field col="5"		name="ANU_BASE_I2"		title="국민연금 회사부담금"	     type="integer">  </field>
		<field col="6"		name="WAGES_DEDMED"		title="건강보험"			 type="integer">  </field>
        <field col="7"      name="MED_I2"           title="건강보험 회사부담금"       type="integer">  </field>
        <field col="8"      name="WAGES_DEDLCI"     title="장기요양보험"           type="integer">  </field>
        <field col="9"      name="WORKER_COMPEN_I"  title="장기요양보험 회사부담금"     type="integer">  </field>
        <field col="10"     name="OLD_MED_COMPEN_I" title="산재보험 회사부담금"       type="integer">  </field>
    </sheet>
</workBook>
