<?xml version="1.0" encoding="UTF-8"  ?>
<!DOCTYPE excelUpload PUBLIC
         "-//TLab//DTD excep upload config XML V1.0//EN"
         "../excel-upload.dtd">
<workBook name="sof102ukrv" desc="일괄수주정보"  validateService="sof102ukrvService.excelValidate">
    <sheet seq="0" name="일괄수주정보" startRow="1" sqlId="sof102ukrvServiceImpl.insertExcelSof102ukrv" validateFormName="sof102ukrv">
        <field col="0" name="OUT_DIV_CODE" title="출고사업장" type="string" required="true" check="true"></field>
        <field col="1" name="PO_NUM" title="발주번호" type="string" required="true" check="true"></field>
        <field col="2" name="PO_SEQ" title="발주순번" type="integer"></field>
        <field col="3" name="ITEM_CODE" title="품목코드" type="string" required="true"></field>
        <field col="4" name="ITEM_NAME" title="품목명" type="string"></field>
        <field col="5" name="ORDER_Q" title="품목수량" type="string"></field>
        <field col="6" name="PO_DATE" title="발주일" type="string"></field>
        <field col="7" name="DVRY_DATE" title="납품요청일" type="string"></field>
        <field col="8" name="CUSTOM_CODE" title="회사코드" type="string" required="true"></field>
        <field col="9" name="CUSTOM_NAME" title="회사명" type="string"></field>
        <field col="10" name="DVRY_CUST_CD" title="납품처코드" type="string"></field>
        <field col="11" name="DVRY_CUST_NM" title="납품처명" type="string"></field>
        <field col="12" name="ORDER_UNIT" title="단위" type="string"></field>
        <field col="13" name="MONEY_UNIT" title="통화" type="string"></field>
        <field col="14" name="ORDER_O" title="금액" type="integer"></field>
        <field col="15" name="ORDER_P" title="단가" type="integer"></field>
        <field col="16" name="REMARK" title="비고" type="string"></field>
        
    </sheet>
</workBook>