<?xml version="1.0" encoding="UTF-8"  ?>
<!DOCTYPE excelUpload PUBLIC
         "-//TLab//DTD excep upload config XML V1.0//EN"
         "../excel-upload.dtd">
         
         
<workBook name="s_hat910ukr_hs" desc="근태"  validateService="s_hat910ukr_hsService.excelValidate" >
    <sheet seq="0" name="근태" startRow="1" sqlId="S_Hat910ukr_hsServiceImpl.insertExcelUpload" validateFormName="s_hat910ukr_hs">
		<field col="0"	 	 name="DUTY_YYYYMMDD"	title="근무일자"	  	type="string" check="true">  	</field>
		<field col="1"	 	 name="GROUP_1"		 	title="회사"	  		type="string">    			</field>
		<field col="2"	 	 name="GROUP_2"			title="부서"	  	  	type="string">   				</field>
		<field col="3"	 	 name="GROUP_3"			title="공백1"	  	  	type="string">   				</field>
		<field col="4"	 	 name="GROUP_4"			title="공백2"	  		type="string">   				</field>
		<field col="5"	 	 name="NAME"			title="이름"	  		type="string">   			</field>
		<field col="6"	 	 name="PERSON_NUMB"		title="사번"	  		type="string">   			</field>
		<field col="7"	 	 name="POST_NAME"		title="직급"	  		type="string">   			</field>
		<field col="8"	 	 name="CARD_NUM"		title="카드번호"	  	type="string">   			</field>
		<field col="9"	 	 name="WORK_TEAM"		title="근무조"	  	type="string">   			</field>
		<field col="10"	 	 name="WORK_TYPE"		title="근무스케쥴"	  	type="string">   			</field>
		<field col="11"	 	 name="DUTY_FR"			title="출근시간"	  	type="string">   			</field>
		<field col="12"	 	 name="DUTY_TO"			title="퇴근시간"	  	type="string">   			</field>
		<field col="13"	 	 name="TEMPC_01"		title="여유컬럼1"	  	type="string">   			</field>
		<field col="14"	 	 name="TEMPC_02"		title="여유컬럼2"	  	type="string">   			</field>
		<field col="16"	 	 name="TEMPC_03"		title="여유컬럼3"	  	type="string">   			</field>
		<field col="17"	 	 name="TEMPC_04"		title="여유컬럼4"	  	type="string">   			</field>
		<field col="18"	 	 name="TEMPC_05"		title="여유컬럼5"	  	type="string">   			</field>
		<field col="19"	 	 name="TEMPC_06"		title="여유컬럼6"	  	type="string">   			</field>
		<field col="20"	 	 name="TEMPC_07"		title="여유컬럼7"	  	type="string">   			</field>
		<field col="21"	 	 name="TEMPC_08"		title="여유컬럼8"	  	type="string">   			</field>
		<field col="22"	 	 name="TEMPC_09"		title="여유컬럼9"	 	type="string">   			</field>
		<field col="23"	 	 name="TEMPC_10"		title="여유컬럼10"	  	type="string">   			</field>
		<field col="24"	 	 name="TEMPC_11"		title="여유컬럼11"	  	type="string">   			</field>
    </sheet>
</workBook>